AcresBurned,AdminUnit,ArchiveYear,CalFireIncident,Counties,CountyIds,Extinguished,Latitude,Location,Longitude,MajorIncident,Name,Started,UniqueId,Duration,Year,AvgPrecip,PrecipBucket
45.0,Moraga-Olinda Fire District ,2018,False,Contra Costa,7,2019-01-04 09:57:00+00:00,37.86339,"Buckingham Dr and Moraga Rd, southwest of Walnut Creek ",-122.12351,False,Buckingham Fire,2018-07-02 14:25:00+00:00,f7bacdf4-ba33-436a-ad94-549395286fc2,185.8138888888889,2018.0,0.021369863013698632,Low
45.0,Marin County Fire,2018,False,Marin,21,2019-01-04 09:22:00+00:00,38.07135,"Platform Bridge Rd. and Point Reyes Station, northeast of Olema ",-122.76751,False,Bridge Fire,1969-12-31 16:00:00+00:00,49232e73-c3ba-4dc3-b673-b973a918fa7c,17900.723611111112,1969.0,,
43.0,CAL FIRE Butte Unit,2018,True,Butte,4,2019-01-04 09:40:00+00:00,39.57202,"Off Highway 162 & Simmons Rd, Lake Oroville",-121.43131,True,Simmons Fire,2018-07-19 12:00:00+00:00,d56aeb11-09a3-4854-b422-9a1e41f18a51,168.90277777777777,2018.0,0.021369863013698632,Low
40.0,CAL FIRE Riverside County Fire,2018,True,Riverside,33,2019-01-04 09:36:00+00:00,33.56921,"Off Martinez Road & Avenue 66, Thermal",-116.154398,False,Martinez Fire,2018-07-23 14:55:00+00:00,e18c9556-706f-4bb7-b908-e7b44293923d,164.77847222222223,2018.0,0.021369863013698632,Low
40.0,CAL FIRE Madera-Mariposa-Merced Unit,2018,True,Mariposa,22,2019-01-04 09:39:00+00:00,37.28365,"Ben Hur Rd & Preston Rd, south of Ben Hur",-119.97546,False,Ben Fire,2018-07-19 13:07:00+00:00,e4c8aa24-e396-46d1-ae6e-bc9c7889967a,168.85555555555555,2018.0,0.021369863013698632,Low
40.0,Unified Command: CAL FIRE Santa Clara Unit and San Ramon Valley Fire Department,2018,True,Contra Costa,7,2019-01-04 10:04:00+00:00,37.779209," off Montbretia Way and Ironwood, East of San Ramon",-121.908976,False,Iron Fire,2018-06-19 15:19:00+00:00,2bee561f-fd8f-44ad-9c25-ccdc671029bc,198.78125,2018.0,0.021369863013698632,Low
40.0,CAL FIRE Butte Unit/Butte County Fire Department,2018,True,Butte,4,2019-01-04 10:05:00+00:00,39.549167,"off Oregon Gulch Road, near View Lane, North of Oroville",-121.521111,False,Oregon Fire,2018-06-16 11:47:00+00:00,9b6b1707-4342-4b38-b4a2-1056c202a32a,201.92916666666667,2018.0,0.021369863013698632,Low
39.0,CAL FIRE San Benito-Monterey Unit,2018,True,San Benito,35,2019-01-04 09:35:00+00:00,36.796,"Hidden Valley Rd & Cienega Rd, south of Hollister",-121.40604,False,Hidden Fire,2018-07-25 14:11:00+00:00,708b3dde-3f1a-4813-8501-8a52bf3b1d9c,162.80833333333334,2018.0,0.021369863013698632,Low
38.0,Redding City Fire,2018,False,Shasta,45,2019-01-04 08:53:00+00:00,40.60866,"Lake Blvd & Masonic Ave, Redding",-122.38366,False,Masonic Fire,2018-10-14 11:33:00+00:00,83c539f5-64c1-4156-86e5-ac6cf4c947d5,81.88888888888889,2018.0,0.021369863013698632,Low
38.0,San Diego City Fire Dept.,2018,False,San Diego,37,2019-01-04 10:16:00+00:00,32.78031,"I-8 and College Ave, San Diego City",-117.06782,False,Adobe Fire,2018-06-03 16:16:00+00:00,8efb9edc-dbe7-4824-9027-22993569f794,214.75,2018.0,0.021369863013698632,Low
37.0,CAL FIRE San Luis Obispo Unit,2018,True,San Luis Obispo,40,2019-01-04 09:38:00+00:00,35.64917,"Paso Robles Rd & Adelaida Rd, west of Paso Robles",-120.71907,False,Mustang Fire,2018-07-21 15:01:00+00:00,a710f41c-aa03-41e1-813f-a98812aea01b,166.77569444444444,2018.0,0.021369863013698632,Low
37.0,CAL FIRE Siskiyou Unit,2018,True,Siskiyou,47,2019-01-04 10:17:00+00:00,41.58233,"Martin Dr. and Stanton Drive, NE of Lake Shastina",-122.33769,False,Martin Fire,2018-06-03 16:14:00+00:00,a9d772ae-90d9-4f8e-9fe7-342b4266dd52,214.75208333333333,2018.0,0.021369863013698632,Low
36.0,CAL FIRE Sonoma-Lake-Napa Unit,2018,True,Lake,17,2019-01-04 09:11:00+00:00,38.981389,"Highland Springs Rd & Old Toll Rd, Kelseyville",-122.97222,False,Ridge Fire,2018-09-02 14:02:00+00:00,9b9b6d81-9590-48a0-a750-fc7da05bfecc,123.79791666666667,2018.0,0.021369863013698632,Low
36.0,CAL FIRE / Riverside County Fire,2018,True,Riverside,33,2019-01-04 09:13:00+00:00,33.640051,"Hidden Falls Road, Winchester",-117.085354,False,Winchester Fire,2018-08-27 10:49:00+00:00,e69be637-e9e9-4964-96ed-4d6a1a1c159d,129.93333333333334,2018.0,0.021369863013698632,Low
35.0,CAL FIRE Mendocino Unit,2018,True,Mendocino,23,2019-01-04 08:49:00+00:00,39.62194,"near Dos Rios, off Highway 162, East of Highway 101 and West of Covelo",-123.28774,False,Brushy Fire,2018-11-08 11:58:00+00:00,10d67079-faa9-4034-a4d7-8346b450e7de,56.86875,2018.0,0.021369863013698632,Low
35.0,CAL FIRE/Riverside County Fire Department,2018,True,Riverside,33,2019-01-04 09:23:00+00:00,33.759722,"off Terramor Road and Temescal Canyon Road, community of Temescal Valley",-117.460278,False,Terra Fire,2018-08-06 14:19:00+00:00,dd114f40-6fcb-487b-931e-7a9107371daa,150.79444444444445,2018.0,0.021369863013698632,Low
35.0,CAL FIRE Shasta-Trinity Unit,2018,True,Shasta,45,2019-01-04 09:29:00+00:00,40.95673,"Hwy 299 E & Hwy 89, east of Burney",-121.6002,False,Corner Fire,2018-07-29 16:22:00+00:00,46f35b6b-9c64-41e3-a7e2-f76dc6719145,158.71319444444444,2018.0,0.021369863013698632,Low
35.0,CAL FIRE San Benito-Monterey Unit,2018,True,San Benito,35,2019-01-04 10:17:00+00:00,36.83036,"Fairview Rd and John Smith Rd, City of Hollister",-121.36446,False,Fairview Fire,2018-06-03 15:09:00+00:00,39ace715-e375-4083-a05c-7fb7448e17b9,214.79722222222222,2018.0,0.021369863013698632,Low
34.0,Kern County Fire ,2018,True,Kern,15,2019-01-04 09:16:00+00:00,35.17156,"off Marcel Drive and Woodford-Tehachapi Road, west of Tehachapi",-118.51651,False,Marcel Fire,2018-08-17 18:47:00+00:00,b03ec37e-8596-4e7e-8826-729957a794f8,139.60347222222222,2018.0,0.021369863013698632,Low
34.0,CAL FIRE Santa Clara Unit,2018,True,Alameda,1,2019-01-04 09:34:00+00:00,37.71173,"Patterson Pass Road and Midway Rd, Altamont ",-121.55604,False,Patterson Fire,2018-07-25 16:05:00+00:00,f306893c-d6b5-4d68-a2a3-4a306822e041,162.72847222222222,2018.0,0.021369863013698632,Low
34.0,Sequoia Kings National Park,2018,False,Tulare,54,2019-01-04 09:39:00+00:00,36.42638,"Mineral King Rd, Ash Mountain area",-118.70443,False,Horse Creek Fire,2018-07-19 16:25:00+00:00,f6693336-817b-4424-8aea-1c966fae5e23,168.71805555555557,2018.0,0.021369863013698632,Low
33.0,CAL FIRE Butte Unit,2018,True,Butte,4,2019-01-04 09:01:00+00:00,39.84151,"Nimshew Rd & Centerville Rd, Magalia",-121.62168,True,Nimshew Fire,2018-09-24 00:41:00+00:00,9856efb8-4d41-4276-9d4e-a5b29d912996,102.34722222222223,2018.0,0.021369863013698632,Low
33.0,CAL FIRE Tehama-Glenn Unit,2018,True,Tehama,52,2019-01-04 09:46:00+00:00,40.00293,"off Oakridge Rd & Horseshoe Dr, Rancho Tehama, southwest of Red Bluff",-122.44008,False,Lariat Fire,2018-07-14 20:40:00+00:00,15d8c9e7-7029-4027-85d8-95f308f83790,173.54583333333332,2018.0,0.021369863013698632,Low
33.0,San Bernardino National Forest,2018,False,San Bernardino,36,2019-01-04 09:57:00+00:00,34.17711,"Hwy 330 and Old City Creek Rd, Community of Running Springs",-117.15381,False,Creek Fire,2018-06-30 12:12:00+00:00,d4618db6-e417-4590-8c1f-9b5ace341bb3,187.90625,2018.0,0.021369863013698632,Low
33.0,CAL FIRE Tulare Unit,2018,True,Tulare,54,2019-01-03 09:44:00+00:00,0.0,"Road 136 and Avenue 440, Community of Orosi",0.0,False,Wilcox Fire,2018-02-18 13:45:00+00:00,485eb9e1-80a1-4b95-a71e-8e43ccb1dd80,318.8326388888889,2018.0,0.021369863013698632,Low
32.0,Sierra National Forest,2018,False,Fresno,10,2019-01-04 09:47:00+00:00,36.938674," Bobs Flat Trail, 3 miles north of Trimmer",-119.3127769,False,Eagle Fire,2018-10-02 15:45:00+00:00,8c4b830f-be4f-4469-9448-f0e98ea1d189,93.75138888888888,2018.0,0.021369863013698632,Low
32.0,CAL FIRE / Riverside County Fire,2018,True,Riverside,33,2019-01-04 09:15:00+00:00,33.97902,off High Country Drive in Moreno Valley,-117.20534,False,Country Fire,2018-08-25 11:58:00+00:00,2bdeaf01-fe98-4f63-b2e8-4857815bc87c,131.88680555555555,2018.0,0.021369863013698632,Low
32.0,CAL FIRE Lassen-Modoc Unit,2018,True,Lassen,18,2019-01-04 09:42:00+00:00,41.08583,"Punkin Center Road and Juniper Road, 6 miles southwest of the Community of Bieber",-121.05722,False,3-18 Fire,2018-07-15 16:45:00+00:00,f141dba0-ae4b-4972-b926-81d1595d0917,172.70625,2018.0,0.021369863013698632,Low
32.0,CAL FIRE Sonoma-Lake-Napa Unit,2018,True,Lake,17,2019-01-04 10:05:00+00:00,38.886518,"off Rocky Creek Road at Morgan Valley Rd, community of Lower Lake",-122.476381,False,Creek Fire,2018-06-16 14:04:00+00:00,af251be5-4fa6-4ced-954c-a0e0aa34a517,201.83402777777778,2018.0,0.021369863013698632,Low
31.0,CAL FIRE Shasta-Trinity Unit,2018,True,Shasta,45,2019-01-04 09:53:00+00:00,40.62693,"off Hwy 299 E and Deschutes Rd, Bella Vista",-122.23449,False,Vista Fire,2018-07-08 14:41:00+00:00,9636bdf4-8754-4745-80c8-90a5fcd90ec2,179.8,2018.0,0.021369863013698632,Low
30.0,CAL FIRE Santa Clara Unit,2018,True,Santa Clara,43,2019-01-04 09:02:00+00:00,37.33563,"Quimby Rd & Borden Dr, East San Jose ",-121.75815,False,Quimby Fire,2018-09-23 16:23:00+00:00,04100255-b014-4a69-92c2-5388c7f9b9d6,102.69375,2018.0,0.021369863013698632,Low
30.0,Contra Costa County Fire,2018,False,Contra Costa,7,2019-01-04 09:17:00+00:00,37.99618,"off Highway 4 and Alhambra Ave, Martinez",-122.14097,False,Alhambra Fire,2018-08-17 19:19:00+00:00,f012f0ea-4102-47dc-9c6d-609ebac85142,139.58194444444445,2018.0,0.021369863013698632,Low
30.0,CAL FIRE Santa Clara Unit,2018,True,Alameda,1,2019-01-04 09:25:00+00:00,37.533026,"Welch Creek Rd and Geary Rd., southeast of Sunol",-121.79733,False,Creek Fire,2018-08-04 17:32:00+00:00,6bc7ef6f-2d81-4bdc-ab41-9db6af9d4abb,152.66180555555556,2018.0,0.021369863013698632,Low
30.0,CAL FIRE Riverside Coounty,2018,True,Riverside,33,2019-01-04 09:30:00+00:00,33.85852,"El Sobrante Road at McAllister Street, Lake Matthews",-117.43521,False,Sobrante Fire,2018-07-28 15:38:00+00:00,45845135-0abc-4964-9038-db1e26fa9b22,159.74444444444444,2018.0,0.021369863013698632,Low
30.0,CAL FIRE San Luis Obispo Unit,2018,True,San Luis Obispo,40,2019-01-04 09:38:00+00:00,35.68539,"off Chimney Rock Rd and Gage Irving Rd, south of Lake Nacimiento (San Luis Obispo County)",-120.95157,False,Rock Fire,2018-07-21 15:50:00+00:00,5b5274df-2cb7-402e-b002-778cce00ac1d,166.74166666666667,2018.0,0.021369863013698632,Low
30.0,Unified Command: CAL FIRE Amador-El Dorado Unit and Sacramento Metro Fire,2018,True,Sacramento,34,2019-01-04 09:58:00+00:00,38.595865,"off Grant Line Rd and White Rock Rd, southwest of Folsom",-121.17693,False,Grant Fire,2018-06-29 15:46:00+00:00,c8060137-4a83-479b-9f36-429a698aac06,188.75833333333333,2018.0,0.021369863013698632,Low
30.0,CAL FIRE / Fresno County Fire,2018,True,Fresno,10,2019-01-03 09:46:00+00:00,35.92436,"25th Ave & Ultica Ave, south of Kettleman City",-119.94083,False,Aqueduct Fire,2018-04-12 14:30:00+00:00,a97e2077-2013-459a-baa7-276781503e3c,265.8027777777778,2018.0,0.021369863013698632,Low
28.0,CAL FIRE San Diego County Fire Authority,2018,True,San Diego,37,2019-01-04 09:41:00+00:00,32.557566,north of the Meixcan border and east of the Otay port of entry,-116.8663,False,Border Fire,2018-07-17 14:05:00+00:00,1dad019f-12c1-47a0-a20c-2408d942f1c4,170.81666666666666,2018.0,0.021369863013698632,Low
27.0,CAL FIRE Siskiyou Unit,2018,True,Siskiyou,47,2019-01-04 10:24:00+00:00,41.791859,"off Ager Road, northeast of Montague",-122.513883,False,Ager Fire,2018-05-19 13:04:00+00:00,454ed7a0-3e17-47a6-9ff1-7a629471df5c,229.88888888888889,2018.0,0.021369863013698632,Low
26.0,CAL FIRE Tulare Unit,2018,True,Tulare,54,2019-01-04 10:24:00+00:00,35.826333,"off Road 272 and Avenue 2, east of Delano",-118.9821,False,White Fire,2018-05-18 11:00:00+00:00,0d030a31-8531-4172-88f1-08ac34c3d805,230.975,2018.0,0.021369863013698632,Low
25.0,Soboba Fire Department,2018,False,Riverside,33,2019-01-04 09:04:00+00:00,33.80406,"off Soboba Rd. San Jacinto, northeast of San Jacinto City, Soboba ",-116.93188,False,Soboba Fire,2018-09-14 19:32:00+00:00,d5885e9d-1310-4f84-a658-d972d17ecad9,111.56388888888888,2018.0,0.021369863013698632,Low
25.0,CAL FIRE Santa Clara Unit,2018,True,Contra Costa,7,2019-01-04 10:05:00+00:00,38.015323,"off Willow Pass Road at Evora Road, Baypoint",-121.998967,False,Willow Fire,2018-06-16 15:10:00+00:00,0ffbb118-8070-4220-95a7-cdef27b0a7ae,201.78819444444446,2018.0,0.021369863013698632,Low
25.0,CAL FIRE San Luis Obispo Unit,2018,True,San Luis Obispo,40,2019-01-04 10:20:00+00:00,35.71859,"Estrella Rd and Airport Rd, North of Paso Robles",-120.64028,False,Vineyard Fire,2018-05-29 13:11:00+00:00,4b641aa9-e8b4-492e-a181-f1bad47c4d6d,219.88125,2018.0,0.021369863013698632,Low
24.0,CAL FIRE Sonoma-Lake-Napa Unit,2018,True,Lake,17,2019-01-04 09:11:00+00:00,38.91842,"Kelsey Creek Rd & Conklin Ln, Kelseyville",-122.85276,True,Kelsey Fire,2018-09-03 13:58:00+00:00,1a3ccacd-e743-4a0b-97ab-4d99a133654e,122.80069444444445,2018.0,0.021369863013698632,Low
23.0,CAL FIRE / Riverside County Fire,2018,True,Riverside,33,2019-01-04 09:15:00+00:00,33.946896,"Hwy 60 and Jack Rabbit Trail, Beaumont",-117.066643,False,Land Fire,2018-08-22 13:45:00+00:00,f81830b2-ece2-4f59-87c7-fd43193bd996,134.8125,2018.0,0.021369863013698632,Low
23.0,CAL FIRE Santa Clara Unit,2018,True,Contra Costa,7,2019-01-04 10:19:00+00:00,37.99113,Glen Canyon Circle and  Chaparral Drive  SE of Pittsburg,-121.86473,False,Glen Fire,2018-06-02 12:42:00+00:00,abe0e447-8977-406f-9e13-5514f4e954bc,215.90069444444444,2018.0,0.021369863013698632,Low
23.0,CAL FIRE Tehama-Glenn Unit,2018,True,Tehama,52,2019-01-04 10:19:00+00:00,40.201826,"Plymire Rd and Deer Valley Rd, West of Red Bluff ",-122.29388,False,Plymire Fire,2018-06-01 16:07:00+00:00,b48e83d3-eb05-47df-a198-185912d8190e,216.75833333333333,2018.0,0.021369863013698632,Low
22.0,CAL FIRE Madera-Mariposa-Merced ,2018,True,Mariposa,22,2019-01-04 09:24:00+00:00,37.69965,"Texas Hill Rd and Bondurant Mine Rd, east of Coulterville",-120.0545,False,Wagner Fire,2018-08-04 13:57:00+00:00,deb9364c-ab73-4661-b287-2ffc1797296e,152.81041666666667,2018.0,0.021369863013698632,Low
21.0,CAL FIRE / Riverside County Fire,2018,True,Riverside,33,2019-01-03 09:46:00+00:00,33.86439,"Tin Mine Rd, north of the Cajalco Expressway",-117.48144,False,Meadow Fire,2018-04-09 18:18:00+00:00,9a49cf24-0e41-4817-b0d0-966e7b5c7e77,268.64444444444445,2018.0,0.021369863013698632,Low
20.0,CAL FIRE Santa Clara Unit,2018,True,Contra Costa,7,2019-01-04 08:44:00+00:00,37.81111,"Off Morgan Territory Rd & Storybook Ln, east of San Ramon",-121.7944,False,Morgan Fire,2018-11-15 13:31:00+00:00,e83e7346-5b83-4e3a-845c-867fd84d17f0,49.800694444444446,2018.0,0.021369863013698632,Low
20.0,CAL FIRE Santa Clara Unit,2018,True,Alameda,1,2019-01-04 08:45:00+00:00,37.61158," off Palomares Road Niles Canyon Road, northwest of Sunol",-121.94182,False,Niles Fire,2018-11-14 14:56:00+00:00,03f49769-b928-44a5-be82-236d3d341eba,50.74236111111111,2018.0,0.021369863013698632,Low
20.0,CAL FIRE Santa Clara Unit,2018,True,Santa Clara,43,2019-01-04 09:33:00+00:00,37.07793,"Monterey Road and Church Ave, San Martin",-121.600023,False,Church Fire,2018-07-25 16:14:00+00:00,655b2bde-09c6-43b8-9cdb-43096bcf1155,162.72152777777777,2018.0,0.021369863013698632,Low
20.0,CAL FIRE Santa Clara Unit,2018,True,Alameda,1,2019-01-04 10:04:00+00:00,37.627119,"off Vallecitos Road and Little Valley, south of Livermore",-121.806775,False,Vallecitos Fire,2018-06-17 15:56:00+00:00,1f49d4b1-f08f-4fce-8b55-48ff0e521a2f,200.75555555555556,2018.0,0.021369863013698632,Low
20.0,CAL FIRE / Riverside County Fire,2018,True,Riverside,33,2019-01-04 10:06:00+00:00,33.524412,"off Crazy Horse Canyon Drive and Bridle Trail Road, Community of Aguanga",-116.821724,False,Bridle Fire,2018-06-14 17:02:00+00:00,764b9aac-411e-442d-a045-1bd02ec773c2,203.7111111111111,2018.0,0.021369863013698632,Low
20.0,CAL FIRE Butte Unit,2018,True,Butte,4,2019-01-04 10:07:00+00:00,39.602703,"off Highway 70 at Table Mountain Road, north of Oroville",-121.617698,False,70 Fire,2018-06-14 15:18:00+00:00,59b452f4-04fe-4251-8cf9-70dfc53ada0c,203.78402777777777,2018.0,0.021369863013698632,Low
20.0,Los Angeles City Fire Department,2018,False,Los Angeles,19,2019-01-04 10:07:00+00:00,34.110516,off Westwanda Drive and Benedict Canyon Drive,-118.427886,False,Portola Fire ,2018-06-12 14:56:00+00:00,7307857b-b127-4b3a-bf11-ee19d07e0736,205.79930555555555,2018.0,0.021369863013698632,Low
20.0,USFS - Plumas National Forest,2018,False,Plumas,32,2019-01-04 10:27:00+00:00,39.89075,"Frenchman Lake Rd., south of Frenchman Lake, 7 miles north of Chilcoot",-120.18499,False,French Fire,2018-04-26 15:00:00+00:00,508b3f52-3a8e-4572-99a9-73c28bbdfbef,252.81041666666667,2018.0,0.021369863013698632,Low
18.0,Unified Command: CAL FIRE and Camp Pendleton Fire,2018,False,San Diego,37,2019-01-04 10:26:00+00:00,33.40178,"De Luz Rd and Wisecarver fuel break, Camp Pendleton Marine Corps Base",-117.27467,False,Jacques Fire,2018-05-09 22:00:00+00:00,f96cf1fb-78d6-4763-a754-23aac25a3b96,239.51805555555555,2018.0,0.021369863013698632,Low
18.0,CAL FIRE/Riverside County Fire Department,2018,True,Riverside,33,2019-01-03 13:10:00+00:00,33.88744,"Via Del Lago and Alta Calle, Lake Perris, Moreno Valley",-117.16232,False,Lago Fire,2018-04-22 13:35:00+00:00,fb8c9354-384c-45ab-b209-4a0f6d234516,255.98263888888889,2018.0,0.021369863013698632,Low
17.0,CAL FIRE San Mateo - Santa Cruz Unit,2018,True,Santa Cruz,44,2019-01-04 08:50:00+00:00,37.0125,"off Highway 9 and Rincon Crossing, north of Santa Cruz  ",-122.046,True,Rincon Fire,2018-11-03 21:28:00+00:00,7d1f523d-6940-4b64-bc5a-7ecb5a63538a,61.47361111111111,2018.0,0.021369863013698632,Low
17.0,CAL FIRE Amador-El Dorado Unit,2018,True,Amador,3,2019-01-04 10:05:00+00:00,38.265645,"off China Gulch Road and Comanche Parkway North, Jackson Valley",-120.892404,False,China Fire,2018-06-17 13:58:00+00:00,43d24c96-7841-423f-9e14-bc9a7ff49416,200.83819444444444,2018.0,0.021369863013698632,Low
17.0,CAL FIRE/ Riverside County Fire,2018,True,Riverside,33,2019-01-04 10:17:00+00:00,33.742,"Highway 74 and Ethanac Rd, City of Perris",-117.28189,False,Ethanac Fire,2018-06-03 14:17:00+00:00,368fb83d-2660-4d9f-b6ad-0a2ef5de1e52,214.83333333333334,2018.0,0.021369863013698632,Low
16.0,CAL FIRE Nevada-Yuba-Placer Unit,2018,True,Nevada,29,2019-01-04 09:19:00+00:00,39.10494,"off Oak Lane and Buck Mountain Road, south of Grass Valley",-121.07039,False,Oak Fire,2018-08-12 14:20:00+00:00,b2695350-87ea-49f4-a579-ce0c4cf7f926,144.79097222222222,2018.0,0.021369863013698632,Low
16.0,CAL FIRE Humboldt-Del Norte Unit,2018,True,Humboldt,12,2019-01-04 09:43:00+00:00,41.34453,Highway 169 in Pecwan,-123.85404,False,Johnson Fire,2018-07-15 16:14:00+00:00,8c94a8f0-1d63-4ea7-88af-52fee196a9a6,172.72847222222222,2018.0,0.021369863013698632,Low
16.0,CAL FIRE Santa Clara Unit,2018,True,Santa Clara,43,2019-01-04 10:22:00+00:00,37.21803,"Keeler Court and Santa Teresa Blvd., south of San Jose",-121.76828,False,Keeler Fire,2018-05-27 17:05:00+00:00,7f775329-242f-4211-b564-92f90062c227,221.7201388888889,2018.0,0.021369863013698632,Low
15.0,CAL FIRE Siskiyou Unit,2018,True,Siskiyou,47,2019-01-04 08:55:00+00:00,41.94046,1 mile northwest of Iron Gate Dam,-122.43933,False,Iron Gate Fire,2018-10-10 21:50:00+00:00,28725d54-51bc-41f9-99ed-aca0396be12a,85.46180555555556,2018.0,0.021369863013698632,Low
15.0,Modoc National Forest,2018,False,Modoc,25,2019-01-04 09:11:00+00:00,41.52123,"East of Essex Reservoir, northeast of Canby.",-120.72362,False,Essex Fire,2018-09-02 14:53:00+00:00,e9d48e43-940e-4151-9ffb-20881d03c151,123.7625,2018.0,0.021369863013698632,Low
15.0,CAL FIRE/ Riverside County Fire,2018,True,Riverside,33,2019-01-04 10:26:00+00:00,33.467999,"Hwy 79 & Woodchuck Road, Temecula",-117.003829,False,Woodchuck Fire,2018-05-04 18:53:00+00:00,08a9481d-8742-4256-a419-2a59196e0a8d,244.64791666666667,2018.0,0.021369863013698632,Low
15.0,CAL FIRE/Riverside County Fire Department,2018,True,Riverside,33,2019-01-03 09:46:00+00:00,33.711263,"Tyler Street and Vista Del Sur, Coachella, City of Coachella",-116.164058,True,Tyler Fire,2018-04-15 04:38:00+00:00,8b34406c-93b7-4a40-a832-2fc525876e59,263.2138888888889,2018.0,0.021369863013698632,Low
14.0,CAL FIRE San Diego Unit,2018,True,San Diego,37,2019-01-04 09:24:00+00:00,33.05737,"off Old Julian Highway and Creek Hollow, west of Ramona",-116.77154,False,Casner Fire,2018-08-06 10:31:00+00:00,775494c3-ae61-40aa-82b0-667a3ddcbdcc,150.95347222222222,2018.0,0.021369863013698632,Low
14.0,CAL FIRE San Luis Obispo Unit,2018,True,San Luis Obispo,40,2019-01-04 09:41:00+00:00,35.70086,"off Gage Irving Road, South Lake Nacimiento",-120.97339,False,Camp Fire,2018-07-17 11:13:00+00:00,0194a44a-0c12-4e47-a053-f3b9b2382858,170.9361111111111,2018.0,0.021369863013698632,Low
14.0,CAL FIRE Lassen-Modoc Unit,2018,True,Lassen,18,2019-01-04 09:45:00+00:00,39.99309,"off Homestead Ranch Road, southeast of Doyle ",-120.02137,False,3-2 Fire,2018-07-14 15:00:00+00:00,b89ae0bb-4b8b-47f6-b7c6-5e689a265288,173.78125,2018.0,0.021369863013698632,Low
14.0,CAL FIRE Sonoma-Lake-Napa Unit ,2018,True,Yolo,57,2019-01-04 10:20:00+00:00,38.64953,"County Road 25 and County Road 86A, community of Madison north of Winters       ",-122.01762,False,Madison FIre,2018-06-01 13:31:00+00:00,4235f934-ed24-425d-821c-46363dcb16e8,216.8673611111111,2018.0,0.021369863013698632,Low
13.0,Shasta Lake Fire Protection District,2018,False,Shasta,45,2019-01-04 09:08:00+00:00,40.678889,"Ranchera Road and Hill Boulevard, Shasta Lake City",-122.400556,False,Ranchera Fire,2018-09-04 14:43:00+00:00,20b57ee7-b0b7-47db-8a12-e5fcdb114459,121.76736111111111,2018.0,0.021369863013698632,Low
13.0,CAL FIRE San Diego Unit,2018,True,San Diego,37,2019-01-04 09:39:00+00:00,33.04898,"Old Julian Way & Cinnamon Rock Rd, east of Ramona",-116.78928,True,Cinnamon Fire,2018-07-20 13:07:00+00:00,05fb81ea-7e85-4d0d-9587-64c907a45561,167.85555555555555,2018.0,0.021369863013698632,Low
13.0,CAL FIRE Fresno-Kings Unit,2018,True,Fresno,10,2019-01-04 10:18:00+00:00,36.10499,"Hwy 198 and Coldwell Ln, 10 miles west of Coalinga",-120.55324,False,Coldwell Fire,2018-06-02 09:55:00+00:00,af8fe898-e4a6-4b9f-86a5-e6fc3226832b,216.01597222222222,2018.0,0.021369863013698632,Low
12.0,CAL FIRE Shasta - Trinity Unit,2018,True,Shasta,45,2019-01-04 08:54:00+00:00,40.49618,"Cloverdale & Clear Creek, Near the community of Igo",-122.51597,False,Tower Fire,2018-10-14 06:45:00+00:00,a8f54d41-fc8c-476c-9122-f1357aa166a0,82.08958333333334,2018.0,0.021369863013698632,Low
12.0,"CAL FIRE Amador, El Dorado Unit",2018,True,El Dorado,9,2019-01-04 09:03:00+00:00,38.7448,Meyers Rd in Camino,-120.65672,True,Meyers Fire,2018-09-20 12:39:00+00:00,9ea41d38-ee7c-4394-9ea8-cbf33e788f13,105.85,2018.0,0.021369863013698632,Low
12.0,CAL FIRE San Bernardino Unit,2018,True,San Bernardino,36,2019-01-04 09:47:00+00:00,34.171786,Muscoy,-117.35606,False,Gray Fire,2018-07-13 14:32:00+00:00,8ff78ab4-378d-4e1b-9ba0-b90d8be07a06,174.80208333333334,2018.0,0.021369863013698632,Low
12.0,CAL FIRE Madera-Mariposa-Merced ,2018,True,Madera,20,2019-01-04 09:50:00+00:00,37.22791,"in the area of Road 230 and Road 225, North Fork",-119.50461,False,School Fire,2018-07-10 17:31:00+00:00,f5d14543-5d98-41ca-99f5-09c1197161b2,177.6798611111111,2018.0,0.021369863013698632,Low
12.0,San Rafael Fire ,2018,False,Marin,21,2019-01-04 10:09:00+00:00,37.97638,"Mission Avenue and C Street, City of San Rafael",-122.5275,False,Mission Fire,2018-06-09 15:30:00+00:00,5adaf6fa-0c4a-43e4-bd32-baa089a7f0b2,208.77708333333334,2018.0,0.021369863013698632,Low
12.0,CAL FIRE San Diego Unit,2018,True,San Diego,37,2019-01-04 10:11:00+00:00,33.40769,"Vista Del Lago/Via Ranchitos, Fallbrook",-117.22974,False,Vista Fire,2018-06-05 13:45:00+00:00,a43a2839-d85f-4152-ac07-4a29c31723cf,212.8513888888889,2018.0,0.021369863013698632,Low
12.0,CAL FIRE Siskiyou Unit,2018,True,Siskiyou,47,2019-01-04 10:13:00+00:00,41.64805,"Meamber Creek Road, 8 miles west of Fort Jones",-122.98442,False,Meamber Fire,2018-06-04 15:08:00+00:00,c48eaae5-afb4-472c-be65-7dfbb3c82f4d,213.79513888888889,2018.0,0.021369863013698632,Low
12.0,CAL FIRE San Luis Obispo Unit,2018,True,San Luis Obispo,40,2019-01-04 10:17:00+00:00,35.75737,"Lake Nacimiento, 10 miles west of Paso Robles",-120.91793,False,Resort Fire,2018-06-03 16:11:00+00:00,0fd4a4af-b243-4e88-b983-648d0c127f47,214.75416666666666,2018.0,0.021369863013698632,Low
12.0,CAL FIRE Sonoma-Lake-Napa Unit,2018,True,Napa,28,2019-01-04 10:23:00+00:00,38.16303,"American Canyon Rd, East of American Canyon",-122.23059,False,Bellagio Fire,2018-05-21 11:56:00+00:00,03b0e3c2-7b65-4a7b-b061-d297ebd267f4,227.93541666666667,2018.0,0.021369863013698632,Low
12.0,CAL FIRE Santa Clara Unit,2018,True,Alameda,1,2019-01-04 10:25:00+00:00,37.73835,"Grant Line Road and I-580, east of Livermore",-121.6039,False,Grant Fire,2018-05-14 13:06:00+00:00,f78b2acd-fff2-413a-93d6-8479e138120b,234.88819444444445,2018.0,0.021369863013698632,Low
12.0,CAL FIRE San Diego Unit,2018,True,San Diego,37,2019-01-04 10:25:00+00:00,33.12213,"Volcan Road and Farmer Road, north of the community of Julian",-116.58759,False,Volcan Fire,2018-05-10 20:41:00+00:00,81cf4d22-336d-4035-b2c3-5b5a8cf2fcc2,238.57222222222222,2018.0,0.021369863013698632,Low
11.0,CAL FIRE Butte Unit,2018,True,Butte,4,2019-01-04 09:51:00+00:00,39.66492,"south of Rich Gulch, near Lake Oroville",-121.51772,False,Dark Fire,2018-07-10 12:42:00+00:00,c2dc8734-e165-4fa1-9a1a-f393516bd5a5,177.88125,2018.0,0.021369863013698632,Low
11.0,CAL FIRE Madera-Mariposa-Merced ,2018,True,Madera,20,2019-01-04 09:52:00+00:00,37.19817,"Cornerstone Court, Yosemite Lakes",-119.80414,False,Cornerstone Fire,2018-07-09 17:54:00+00:00,dc55524d-c29f-4990-8f73-2974348c7fc7,178.6652777777778,2018.0,0.021369863013698632,Low
11.0,CAL FIRE/ Riverside County Fire,2018,True,Riverside,33,2019-01-04 10:18:00+00:00,33.47413,"Vuelta Grande Rd and Carancho Rd, Community of De Luz",-117.31468,False,Grande Fire,2018-06-03 13:38:00+00:00,a0b7fa30-74d0-419f-927b-de29b0d00018,214.86111111111111,2018.0,0.021369863013698632,Low
