AcresBurned,AdminUnit,ArchiveYear,CalFireIncident,Counties,CountyIds,Extinguished,Latitude,Location,Longitude,MajorIncident,Name,Started,UniqueId,Duration,Year,AvgPrecip,PrecipBucket
80.0,"**This is no longer a CAL FIRE incident.  At 6 pm on Thursday, June 04, BIA took over management of the fire**",2015,True,Riverside,33,2015-06-05 16:32:00+00:00,0.0,Avenue 66 and Harrison Street near Thermal  ,0.0,False,Harrison Fire,2015-06-01 10:16:00+00:00,c5e798e2-cba3-4d9a-aa19-389f845bf877,4.261111111111111,2015.0,0.016328767123287673,Low
77.0,CAL FIRE Lassen-Modoc Unit,2015,True,Modoc,25,2015-07-25 22:00:00+00:00,40.856422,"in Dixie Valley, southwest of Bieber",-121.101623,False,3-12 Fire,2015-07-23 17:30:00+00:00,12f68592-30e3-461c-b489-bc99ba52a38a,2.1875,2015.0,0.016328767123287673,Low
75.0,CAL FIRE Shasta-Trinity Unit,2015,True,Shasta,45,2015-08-04 18:00:00+00:00,40.67868,"Fern Rd and Oak Run Rd, 1 mile east of the Community of Oak Run",-121.93244,True,Fern Fire,2015-08-02 03:00:00+00:00,dfd02b2e-7e2d-4636-a178-0ebff2d170c8,2.625,2015.0,0.016328767123287673,Low
75.0,CAL FIRE Shasta-Trinity Unit,2015,True,Shasta,45,2015-07-31 18:40:00+00:00,40.509552,off Mallard Way in Millville ,-122.199227,True,Mallard Fire,2015-07-29 16:30:00+00:00,259d9359-0cc2-4058-bfc2-f28ab2a540f4,2.0902777777777777,2015.0,0.016328767123287673,Low
75.0,USFS - El Dorado National Forest ,2015,False,El Dorado,9,2015-07-29 14:15:00+00:00,38.776,off Hwy 50 at White Hall Canyon Dr in Kyburz,-120.404,False,Kyburz Fire,2015-07-23 14:00:00+00:00,74635a69-f34f-4c6e-9e09-1a32d732bb42,6.010416666666667,2015.0,0.016328767123287673,Low
75.0,CAL FIRE Butte Unit,2015,True,Butte,4,2015-07-01 20:20:00+00:00,0.0,"off LaPorte Rd, east of Bangor",0.0,False,Webb Fire,2015-07-01 13:05:00+00:00,8581f0b0-92da-4ce1-8d6f-e32557515a1e,0.3020833333333333,2015.0,0.016328767123287673,Low
72.0,CAL FIRE Butte Unit,2015,True,Butte,4,2015-09-03 19:35:00+00:00,26.42,"Off of Olive Tree Lane, south of Oroville ",-121.0,True,Olive Fire,2015-09-02 13:18:00+00:00,3435fd06-f77e-42c3-8fa5-261cf0cb828c,1.2618055555555556,2015.0,0.016328767123287673,Low
69.0,Klamath National Forest,2015,False,Siskiyou,47,2015-08-22 18:00:00+00:00,0.0,LaHonda Well area northeast of the community of Tennant,0.0,False,Prairie Fire,2015-08-20 16:00:00+00:00,bd869df0-5333-4b9f-957f-b3d563f09f94,2.0833333333333335,2015.0,0.016328767123287673,Low
67.0,Kern County Fire,2015,True,Kern,15,2015-06-15 18:45:00+00:00,35.77937,Off of Hwy 41 near Cottonwood Pass,-120.19482,False,Pass Fire,2015-06-15 15:46:00+00:00,17b99f78-78b8-4bd1-90fc-5d9c3cb61b95,0.12430555555555556,2015.0,0.016328767123287673,Low
65.0,San Bernardino National Foerst,2015,False,San Bernardino,36,2015-08-05 09:00:00+00:00,0.0,"Cajon Pass, I-15 and Highway 138",0.0,False,Scales Fire,2015-08-01 13:04:00+00:00,d95a4f8c-008a-4691-b1b2-9173b4dca34d,3.8305555555555557,2015.0,0.016328767123287673,Low
60.0,CAL FIRE Fresno Unit/Fresno County Fire,2015,True,Fresno,10,2015-07-22 10:00:00+00:00,0.0,"off Powerhouse Rd, near Kercknoff Lake, north of the community of Auberry",0.0,False,Kerkhoff Fire,2015-07-18 16:31:00+00:00,77b8e450-18b2-4fc4-a9d0-403594095482,3.7284722222222224,2015.0,0.016328767123287673,Low
60.0,CAL FIRE Lassen-Modoc Unit,2015,True,Lassen,18,2015-06-20 19:35:00+00:00,40.875667,"Dixie Valley, south of Bieber",-121.033667,False,Dixie Fire,2015-06-19 16:15:00+00:00,1ca8b1e7-5590-448b-86ba-6dfa4937baa6,1.1388888888888888,2015.0,0.016328767123287673,Low
60.0,CAL FIRE Riverside Unit / Riverside County Fire,2015,True,Riverside,33,2015-06-21 07:25:00+00:00,0.0,Off Grapefruit Blvd in Thermal,0.0,False,Grapefruit Fire,2015-06-18 14:16:00+00:00,2d114fe4-57c1-4ac1-a9ec-923dde4d9292,2.714583333333333,2015.0,0.016328767123287673,Low
60.0,CAL FIRE Madera-Mariposa-Merced Unit,2015,True,Mariposa,22,2015-06-19 20:05:00+00:00,0.0,"Triangle Rd and Nickel Plate Rd, north of Bootjack",0.0,True,Triangle Fire,2015-06-18 12:03:00+00:00,8d98f943-8a04-4ad5-b884-84986a521c3f,1.3347222222222221,2015.0,0.016328767123287673,Low
60.0,CAL FIRE Amador-El Dorado Unit,2015,True,Amador,3,2015-06-17 06:45:00+00:00,38.260777,"Dry Creek and E Prouty Rd, west of Herald",-121.135426,False,North Fire,2015-06-16 16:42:00+00:00,e2077d05-1f06-4939-8857-9f630a4b722e,0.5854166666666667,2015.0,0.016328767123287673,Low
59.0,CAL FIRE Shasta-Trinity Unit,2015,True,Shasta,45,2015-08-04 08:15:00+00:00,40.3929,"Gas Point and Happy Valley Rd, west of Cottonwood",-122.40546,True,Point Fire,2015-08-03 14:28:00+00:00,6c5fcfc7-659a-44ee-b225-c4ae919882e7,0.7409722222222223,2015.0,0.016328767123287673,Low
58.0,Shasta-Trinity National Forest ,2015,False,Siskiyou,47,2015-10-10 18:45:00+00:00,0.0,Along Military Pass Road ,0.0,False,Military Fire,2015-10-10 12:00:00+00:00,e4223f98-44fa-44bd-9ec9-3219206068d2,0.28125,2015.0,0.016328767123287673,Low
55.0,USFS - San Bernardino National Forest,2015,False,San Bernardino,36,2015-09-11 15:00:00+00:00,34.23,"at Knickerbocker Road and Pine Knot, south of Big Bear Lake",-116.883,False,Summit Fire,2015-08-23 12:25:00+00:00,d0875efe-54fb-4cc2-b647-4f4d210df118,19.10763888888889,2015.0,0.016328767123287673,Low
55.0,CAL FIRE San Diego Unit,2015,True,San Diego,37,2015-08-10 15:05:00+00:00,33.4115972,De Luz Rd and De Luz Murrieta Rd,-117.2886249,False,De Luz Fire,2015-08-09 08:22:00+00:00,3cc1aa4c-b87d-4b4d-99b1-83dc56291b33,1.2798611111111111,2015.0,0.016328767123287673,Low
55.0,CAL FIRE Tehama-Glenn Unit,2015,True,Tehama,52,2015-06-17 18:30:00+00:00,40.0133,"Off Lowery Rd, north of Paskenta",-122.552,False,Fork Fire,2015-06-17 12:50:00+00:00,7934d7bb-15e1-4217-8fa1-552e4f3d8091,0.2361111111111111,2015.0,0.016328767123287673,Low
54.0,CAL FIRE San Bernardino Unit/San Bernardino National Forest ,2015,True,San Bernardino,36,2015-07-21 07:20:00+00:00,34.0783472,"Mill Creek Rd and Bryant St, east of Mentone",-117.0487863,True,Mill 2 Fire,2015-07-12 14:46:00+00:00,c8fb2c4c-2275-4ad1-aef3-859e332a1a47,8.690277777777778,2015.0,0.016328767123287673,Low
53.0,CAL FIRE Santa Clara Unit,2015,True,Alameda,1,2015-06-25 18:45:00+00:00,0.0,"off Tesla Road, southeast of Livermore",0.0,False,Tesla Fire,2015-06-25 16:10:00+00:00,418c9abb-935a-4157-91a3-f511c197785b,0.1076388888888889,2015.0,0.016328767123287673,Low
52.0,Santa Barbara County Fire,2015,True,Santa Barbara,42,1969-12-31 16:00:00+00:00,34.9522,"off White Oak Ln, east of Santa Maria",-120.2903,False,White Fire,2015-08-01 14:32:00+00:00,f136ba8d-f6bb-4bad-9815-1d56f9dc8650,-16648.93888888889,2015.0,0.016328767123287673,Low
50.0,Ventura County Fire Department,2015,False,Ventura,56,2015-11-07 16:45:00+00:00,34.15,"Hidden Valley area, southwest of Thousand Oaks",-118.879444,False,Potrero Fire,2015-11-07 01:45:00+00:00,3f31752f-4f51-4705-9fe4-50beec88a0e8,0.625,2015.0,0.016328767123287673,Low
50.0,CAL FIRE Mendocino Unit,2015,True,Mendocino,23,2015-08-03 08:55:00+00:00,39.43301,Community of Willits and Brooktrails,-123.36316,False,Mendocino Lightning Fires,2015-07-30 13:36:00+00:00,9f031bfa-47bc-4fee-aca1-988462d6ab53,3.8048611111111112,2015.0,0.016328767123287673,Low
45.0,Kern County Fire Department,2015,True,Kern,15,2015-09-15 19:10:00+00:00,0.0,Antelope Canyon south of Tehachapi,0.0,False,Antelope Fire,2015-09-09 11:45:00+00:00,e1ad9125-1179-4d00-891b-7b62699069d0,6.309027777777778,2015.0,0.016328767123287673,Low
45.0,CAL FIRE Santa Clara Unit,2015,True,Alameda,1,2015-07-03 20:00:00+00:00,0.0,"off Geary Road in the Sunol Wilderness, 10 miles east of Fremont",0.0,False,Geary Fire,2015-07-02 04:40:00+00:00,a6143c76-aa03-4161-bf5e-4d8e4a1136d2,1.6388888888888888,2015.0,0.016328767123287673,Low
45.0,CAL FIRE Fresno-Kings Unit,2015,True,Fresno,10,2015-06-06 20:00:00+00:00,0.0,near Auberry,0.0,False,FKU Lightning Fires,2015-06-05 17:00:00+00:00,8e9dca1d-9ae9-4fc3-89ab-815a4d3f09cc,1.125,2015.0,0.016328767123287673,Low
43.0,USFS - Modoc National Forest ,2015,False,Modoc,25,2015-07-13 11:00:00+00:00,0.0,Near Clear Lake and Mason Reservoir,0.0,False,Mason Fire ,2015-07-09 15:00:00+00:00,ff70bb48-8823-49d9-b6cd-935cc407aacb,3.8333333333333335,2015.0,0.016328767123287673,Low
42.0,CAL FIRE Santa Clara Unit,2015,True,Santa Clara,43,2015-07-03 17:55:00+00:00,0.0,"off Hwy 101 near Monterey Frontage Rd, South of Gilroy",0.0,False,Highway Fire,2015-06-30 15:23:00+00:00,10a86822-77a8-45b1-8caf-aefd7b679db5,3.1055555555555556,2015.0,0.016328767123287673,Low
40.0,CAL FIRE Lassen - Modoc Unit,2015,True,Lassen,18,2015-09-10 07:49:00+00:00,40.400196,"Center Rd, east of Susanville",-120.553075,False,Center Fire,2015-09-09 14:12:00+00:00,75c14933-9916-4dfe-ac66-7d98706a5172,0.7340277777777777,2015.0,0.016328767123287673,Low
40.0,CAL FIRE Santa Clara Unit,2015,True,Stanislaus,50,2015-07-28 15:00:00+00:00,37.24523,"Sullivan Rd and Orestimba Rd, 10 miles West of Newman",-121.20324,False,Sullivan Fire,2015-07-28 12:10:00+00:00,57397ed5-93a3-4e60-9142-9a3e38164ee9,0.11805555555555555,2015.0,0.016328767123287673,Low
40.0,CAL FIRE Sonoma-Lake-Napa Unit,2015,True,Solano,48,2015-07-10 17:00:00+00:00,38.1029,Lake Herman Rd and Sky Valley Rd,-122.1578,True,Ascot Fire,2015-07-10 13:36:00+00:00,dff0f39c-bed4-4910-9c22-d9ccd4142809,0.14166666666666666,2015.0,0.016328767123287673,Low
38.0,CAL FIRE Sonoma-Lake-Napa Unit,2015,True,Napa,28,2015-06-17 13:10:00+00:00,38.5287,"Chiles Pope Valley Rd. & Lower Chiles Valley Rd., East of St. Helena",-122.3415,True,Chiles Fire,2015-06-16 14:27:00+00:00,e3272697-2587-45ac-b525-76b85fabaa90,0.9465277777777777,2015.0,0.016328767123287673,Low
36.0,CAL FIRE Sonoma-Lake-Napa Unit,2015,True,Napa,28,2015-06-10 09:45:00+00:00,0.0,off Pope Valley Road & Howell Mountain Road in Pope Valley ,0.0,True,Garage Fire,2015-06-09 15:23:00+00:00,2513b19f-3509-4e0f-8d87-85785061af02,0.7652777777777777,2015.0,0.016328767123287673,Low
35.0,CAL FIRE Shasta-Trinity Unit,2015,True,Trinity,53,2015-09-10 17:05:00+00:00,40.0,Hwy 299 and Little Browns Creek Rd east of Weaverville,41.46,False,Browns Fire,2015-09-08 15:56:00+00:00,5046e2ed-e2c3-4932-8f89-64dcdf19022d,2.0479166666666666,2015.0,0.016328767123287673,Low
35.0,CAL FIRE Amador El-Dorado Unit,2015,True,El Dorado,9,2015-07-05 11:30:00+00:00,0.0,"off French Creek Rd, south of Shingle Springs",0.0,False,Ranch Fire,2015-07-03 09:28:00+00:00,a4e4603a-f0fc-4d7a-845b-6c668bfcb81e,2.084722222222222,2015.0,0.016328767123287673,Low
35.0,CAL FIRE Mendocino Unit,2015,True,Mendocino,23,2015-06-29 07:15:00+00:00,39.7806004,"off Highway 162 and Cemetery Lane, Covelo",-123.248214,False,Covelo Fire,2015-06-28 13:30:00+00:00,56dc8f9c-98e5-4aad-b3e9-bbee503b29e9,0.7395833333333334,2015.0,0.016328767123287673,Low
30.0,CAL FIRE Nevada-Yuba-Placer Unit,2015,True,Nevada,29,2015-09-21 14:36:00+00:00,39.081,"off McCourtney Rd & Perimeter Rd, east of Camp Far West Reservoir ",-121.194,False,McCourtney Fire,2015-09-22 07:00:00+00:00,c27d03c6-361e-44b3-8335-a1fe06f88fd7,-0.6833333333333333,2015.0,0.016328767123287673,Low
30.0,CAL FIRE Lassen-Modoc Unit,2015,True,Lassen,18,2015-08-30 08:00:00+00:00,41.12362,"off of Kramer Road and 4 Corners Road, west of Beiber ",-121.194256,False,Kramer Fire ,2015-08-29 16:06:00+00:00,bb500714-470e-4529-a15a-11d96e85cc68,0.6625,2015.0,0.016328767123287673,Low
30.0,CAL FIRE Nevada-Yuba-Placer Unit,2015,True,Yuba,58,2015-08-05 07:30:00+00:00,39.33303,Colgate Powerhouse south of Dobbins,-121.18735,False,Francis Fire,2015-08-03 18:07:00+00:00,139766ba-33ac-442e-9a6b-b78d270c110a,1.5576388888888888,2015.0,0.016328767123287673,Low
29.0,Ventura County Fire Department,2015,False,Ventura,56,2015-11-12 18:00:00+00:00,0.0,off Wood Ranch Parkway 2 miles sw of Simi Valley,0.0,False,Banister Fire,2015-11-11 17:40:00+00:00,f843961b-2c26-427d-87ba-0bde7ce9ecba,1.0138888888888888,2015.0,0.016328767123287673,Low
26.0,CAL FIRE Nevada Yuba Placer Unit,2015,True,Placer,31,2015-07-22 19:50:00+00:00,38.9361,"Baxter Grade Rd, 3 miles West of Auburn",-121.1548,False,Baxter Fire,2015-07-22 18:17:00+00:00,ee7ec0f0-4f5d-4fe1-b2fa-bc15f91519b3,0.06458333333333334,2015.0,0.016328767123287673,Low
25.0,CAL FIRE San Diego Unit,2015,True,San Diego,37,2015-07-25 16:05:00+00:00,32.682547,"Off of Lake Morena Drive near Lake Morena Park, north of Campo",-116.51684,False,Park Fire,2015-07-24 12:43:00+00:00,a80b8ab7-eba5-4ef7-9992-0cf828138f1b,1.1402777777777777,2015.0,0.016328767123287673,Low
25.0,CAL FIRE San Benito-Monterey Unit,2015,True,San Benito,35,2015-07-20 15:30:00+00:00,36.8727,"off Hwy 101 between Anzar Rd & Hwy 156, in Aromas",-121.5681,False,Betabel Fire,2015-07-20 13:23:00+00:00,296fc88f-e646-4c89-9b46-3ac0f88ff910,0.08819444444444445,2015.0,0.016328767123287673,Low
25.0,CAL FIRE San Diego Unit,2015,True,San Diego,37,2015-07-17 15:15:00+00:00,33.21407,"off Highway 76, near Moretti Junction, near Lake Henshaw",-116.73472,False,Lake Fire,2015-07-16 11:30:00+00:00,98b0706c-ac34-4d9a-9ceb-55996099daed,1.15625,2015.0,0.016328767123287673,Low
25.0,CAL FIRE Amador El Dorado Unit,2015,True,El Dorado,9,2015-07-05 11:30:00+00:00,0.0,off Bucks Bar Cir & Buckaroo Trail near Somerset,0.0,False,Buckaroo Fire,2015-07-02 17:10:00+00:00,f251d96b-f29d-46eb-be0a-9f431837d8f5,2.763888888888889,2015.0,0.016328767123287673,Low
25.0,CAL FIRE Madera-Mariposa-Merced Unit  ,2015,True,Mariposa,22,2015-06-09 09:00:00+00:00,0.0,"Lookout Mountain Rd & Fox Field Lane, south of Mormon Bar",0.0,True,Fox Fire,2015-06-07 12:06:00+00:00,794934ea-f2b0-4b88-b853-3f2510654e09,1.8708333333333333,2015.0,0.016328767123287673,Low
25.0,CAL FIRE Sonoma-Lake-Napa Unit,2015,True,Lake,17,2015-06-06 06:45:00+00:00,0.0,Hwy 20 near Lake County- Colusa County Line,0.0,False,Oasis Fire,2015-06-05 19:57:00+00:00,a992b7d3-64d5-420e-8c26-0ded8f828414,0.45,2015.0,0.016328767123287673,Low
25.0,CAL FIRE Riverside Unit,2015,True,Riverside,33,2015-06-05 19:00:00+00:00,0.0,"Snow Creek Road, south of Highway 111",0.0,False,Snow Fire,2015-06-05 13:32:00+00:00,9987126f-9cfe-4cae-baf6-8b0d82969e51,0.22777777777777777,2015.0,0.016328767123287673,Low
24.0,CAL FIRE Siskiyou Unit,2015,True,Siskiyou,47,2015-07-22 17:00:00+00:00,41.999341,"Off Hwy 161 & Hwy 97, northeast of Dorris",-121.891226,True,Dorris Fire,2015-07-21 17:00:00+00:00,098eb80f-1ecb-489d-baef-1440fa0e98d6,1.0,2015.0,0.016328767123287673,Low
23.0,CAL FIRE Mendocino Unit,2015,True,Mendocino,23,2015-07-05 09:00:00+00:00,39.0263,"off Hwy 253, 4 miles northeast of Boonville (Mendocino County).",-123.303,False,Soda Fire,2015-07-04 15:30:00+00:00,58dda3b8-3643-4f73-bee0-0a4cae0cb079,0.7291666666666666,2015.0,0.016328767123287673,Low
22.0,CAL FIRE Sonoma Lake Napa,2015,True,Lake,17,2015-08-25 18:30:00+00:00,38.831478,"Jerusalem Grade Rd & June Bug Rd, 7 miles northeast of Middletown",-122.53428,False,Grade Fire,2015-08-24 12:12:00+00:00,909d6135-070c-4e3b-ba22-23877fb603c3,1.2625,2015.0,0.016328767123287673,Low
21.0,Los Padres National Forest,2015,False,Santa Barbara,42,2015-11-09 12:00:00+00:00,34.4828,between Montecito Peak and Coldspring Saddle,-119.63216,False,Gibraltar Fire,2015-10-29 05:30:00+00:00,fbd3c0a8-7191-473c-bb05-43616711b6c5,11.270833333333334,2015.0,0.016328767123287673,Low
21.0,CAL FIRE Riverside County Fire,2015,True,Riverside,33,2015-07-12 19:48:00+00:00,33.986204,"San Timoteo Canyon Rd and Redlands Blvd, northeast of Moreno Valley",-117.43942,True,Spider Fire,2015-07-12 13:52:00+00:00,48284911-67cd-4394-8aad-053d3b2cf5db,0.24722222222222223,2015.0,0.016328767123287673,Low
20.0,CAL FIRE Humboldt-Del Norte Unit ,2015,True,Humboldt,12,2015-06-11 18:15:00+00:00,41.1513,"off Bald Hills Rd, 15 miles east of Hwy 101 & Orick ",-123.8292,True,Bald Fire,2015-06-10 07:42:00+00:00,ccd896f2-f071-4d26-ba9b-f413de4d6b77,1.4395833333333334,2015.0,0.016328767123287673,Low
19.0,CAL FIRE Sonoma-Lake-Napa Unit,2015,True,Napa,28,2015-06-28 18:00:00+00:00,38.519132,"Steele Canyon Rd. and Headlands Dr., Lake Berryessa",-122.181878,False,Pleasure Fire,2015-06-27 12:51:00+00:00,7c98e8db-6a6a-4f66-bfe7-7d24e926c986,1.2145833333333333,2015.0,0.016328767123287673,Low
18.0,CAL FIRE Shasta-Trinity Unit,2015,True,Shasta,45,2015-07-08 16:30:00+00:00,40.5953,"Middle Creek Road, north of Hwy 299",-122.4397,True,Keswick Fire,2015-07-07 12:34:00+00:00,64fa2a72-b964-421d-b88f-5ac2e37647d4,1.163888888888889,2015.0,0.016328767123287673,Low
16.0,CAL FIRE Humboldt-Del Norte Unit,2015,True,Humboldt,12,2015-07-31 19:00:00+00:00,40.1093,off Alderpoint Road & Wallan Road near Garberville ,-123.774,False,Buck Fire,2015-07-28 17:19:00+00:00,0a645cbe-2d5a-4e2b-80c9-cb9167641cca,3.0701388888888888,2015.0,0.016328767123287673,Low
0.0,USFS - Six Rivers National Forest,2015,False,Trinity,53,2015-08-01 15:25:00+00:00,0.0,Near Ruth Lake area,0.0,False,Mad River Complex,2015-07-30 16:00:00+00:00,3e699b76-7a4b-4b5d-a391-89b640953195,1.9756944444444444,2015.0,0.016328767123287673,Low
0.0,US Forest Service - Humboldt - Toiyabe National Forest,2015,False,Alpine,2,2015-06-22 12:05:00+00:00,38.598056,south of Markleeville,-119.751944,False,Washington Fire,2015-06-19 19:00:00+00:00,470d19d4-384d-497a-9770-cd2e2a3f3196,2.7118055555555554,2015.0,0.016328767123287673,Low
132127.0,US Forest Service - Los Padres National Forest,2016,True,Monterey,27,2016-10-13 11:30:00+00:00,36.45994,"Soberanes Creek, Garrapata State Park, Palo Colorado, north of Big Sur",-121.89938,True,Soberanes Fire,2016-07-22 08:48:00+00:00,977ac7ce-4204-4cd3-9f89-727142165261,83.1125,2016.0,0.028060109289617486,Medium
48019.0,Bureau of Land Management,2016,True,Kern,15,2016-07-11 09:40:00+00:00,35.6115,Off Erskine Creek Rd in Lake Isabella,-118.45628,False,Erskine Fire,2016-06-23 15:51:00+00:00,91816ff6-d4ec-4f31-8d40-bf2538aca09b,17.742361111111112,2016.0,0.028060109289617486,Medium
46344.0,CAL FIRE San Luis Obispo Unit,2016,True,San Luis Obispo,40,2016-09-06 07:30:00+00:00,35.70595,Running Deer Rd & Chimney Rock Rd south of Lake Nacimiento ,-120.98316,True,Chimney Fire,2016-08-13 16:03:00+00:00,040d03d0-fbdd-438c-8174-f81e4a1bba57,23.64375,2016.0,0.028060109289617486,Medium
36274.0,San Bernardino National Forest ,2016,True,San Bernardino,36,2016-08-23 07:45:00+00:00,34.30372,"off of I-15 and Hwy 138, north of San Bernardino ",-117.49342,True,Blue Cut Fire,2016-08-16 10:44:00+00:00,ea5193a1-69bc-4684-bfcd-235c17d36756,6.875694444444444,2016.0,0.028060109289617486,Medium
33867.0,USFS Klamath National Forest,2016,False,Siskiyou,47,2016-08-28 18:15:00+00:00,41.851,"off Seiad Creek Rd, 5 miles northeast o Seiad Valley",-123.118,False,Gap Fire,2016-08-27 18:00:00+00:00,85683fd7-b507-4ec7-8bbd-fb7033a42665,1.0104166666666667,2016.0,0.028060109289617486,Medium
32606.0,Los Padres National Forest,2016,True,Santa Barbara,42,2016-09-15 15:20:00+00:00,0.0,"off of Hwy 154 and Paradise Rd, north of Santa Barbara",0.0,False,Rey Fire ,2016-08-18 17:57:00+00:00,dc3f57ff-a935-4c25-bbe3-e00eeb5b5f42,27.89097222222222,2016.0,0.028060109289617486,Medium
29322.0,Sequoia National Forest,2016,False,Kern,15,2016-10-01 06:00:00+00:00,35.7506,"off of Hwy 155 in the Greenhorn Mountains, west of Wofford Heights",-118.5678,False,Cedar Fire,2016-08-16 16:35:00+00:00,e247e423-6171-4184-9dca-b373de703885,45.55902777777778,2016.0,0.028060109289617486,Medium
12518.0,Vandenberg Air Force Base,2016,False,Santa Barbara,42,2016-09-27 14:00:00+00:00,34.63445,"Santa Ynez Ridge Road and Egress Road, south side of Vandenberg Air Force Base",-120.54421,False,Canyon Fire,2016-09-17 17:20:00+00:00,f6afb8c4-32dc-4e6d-8d30-e6b7ccd4a62f,9.86111111111111,2016.0,0.028060109289617486,Medium
8110.0,San Bernardino National Forest,2016,True,San Bernardino,36,2016-08-16 08:00:00+00:00,34.28771,"Pilot Rock & Hwy 138, southeast of Hesperia",-117.27338,True,Pilot Fire,2016-08-07 12:18:00+00:00,69c7b8cc-061e-4ca6-b5e8-83c6ae9d8a25,8.820833333333333,2016.0,0.028060109289617486,Medium
7609.0,CAL FIRE San Diego Unit,2016,True,San Diego,37,2016-06-30 18:30:00+00:00,32.60729,off Highway 188 and Highway 94 near Tecate,-116.63028,True,Border Fire,2016-06-19 11:03:00+00:00,33099cdd-ccfc-454e-b5a3-770a69a30bd3,11.310416666666667,2016.0,0.028060109289617486,Medium
7474.0,U.S Los Padres National Forest ,2016,True,Santa Barbara,42,2016-07-12 14:30:00+00:00,34.776,west of Goleta,-119.643,True,Sherpa Fire,2016-06-15 15:21:00+00:00,ffb3293b-3349-49c5-a7cb-c488391e8a72,26.964583333333334,2016.0,0.028060109289617486,Medium
7050.0,CAL FIRE Fresno Kings Unit,2016,True,Fresno,10,2016-08-18 19:00:00+00:00,36.09974,"off Hwy 198 & Mineral Springs Rd, W of Coalinga",-120.51057,True,Mineral Fire,2016-08-09 13:08:00+00:00,346c59b1-375e-4d42-876a-d97b769c939f,9.244444444444444,2016.0,0.028060109289617486,Medium
5731.0,CAL FIRE Sonoma Lake Napa Unit,2016,True,Yolo,57,2016-08-12 15:00:00+00:00,38.52513,"off of Highway 128 west of Pleasants Valley Road, west of Winters",-122.06788,True,Cold Fire,2016-08-02 16:36:00+00:00,057fd4e2-7400-4fc4-9b23-3daf67fc8610,9.933333333333334,2016.0,0.028060109289617486,Medium
5646.0,CAL FIRE Nevada-Yuba-Placer Unit / El Dorado National Forest,2016,True,El Dorado,"9,31",2016-07-18 09:50:00+00:00,38.96741,along the  Middle Fork of the American River near Todd Valley,-120.9375,True,Trailhead Fire,2016-06-28 13:55:00+00:00,b604ffa7-8cee-4724-bb82-f1f4553a192f,19.82986111111111,2016.0,0.028060109289617486,Medium
5646.0,CAL FIRE Nevada-Yuba-Placer Unit / El Dorado National Forest,2016,True,Placer,"9,31",2016-07-18 09:50:00+00:00,38.96741,along the  Middle Fork of the American River near Todd Valley,-120.9375,True,Trailhead Fire,2016-06-28 13:55:00+00:00,b604ffa7-8cee-4724-bb82-f1f4553a192f,19.82986111111111,2016.0,0.028060109289617486,Medium
5443.0,Inyo National Forest,2016,False,Inyo,14,2016-09-18 08:10:00+00:00,37.75985,"Clark Canyon, north of Mammoth Lakes, east of Hwy 395",-118.95309,False,Owens River Fire,2016-09-17 13:49:00+00:00,821c040d-a17c-4934-990f-ca7d441a303a,0.7645833333333333,2016.0,0.028060109289617486,Medium
5399.0,Angeles National Forest,2016,False,Los Angeles,19,2018-04-23 15:07:00+00:00,0.0,south of Azusa,0.0,False,San Gabriel Complex (Formerly Fish & Reservoir Fires),2016-06-20 13:59:00+00:00,2b8f9fdc-f812-4d72-9163-c5356d8ae04b,672.0472222222222,2016.0,0.028060109289617486,Medium
4824.0,Angeles National Forest ,2016,False,Los Angeles,19,2016-11-14 14:00:00+00:00,34.31,Lake View Terrace,-118.335,False,Marek Fire,2016-11-14 05:45:00+00:00,ca1227b3-1458-44c9-b32e-2994e309f940,0.34375,2016.0,0.028060109289617486,Medium
4474.0,CAL FIRE Santa Clara Unit,2016,True,Santa Clara,43,2017-09-19 10:30:00+00:00,37.10632,off Loma Prieta Rd and Loma Chiquita Rd 10 miles NW of Morgan Hill,-121.85318,True,Loma Fire,2016-09-26 14:42:00+00:00,2dfac408-d2ab-4ff9-94aa-91be9d07bb59,357.825,2016.0,0.028060109289617486,Medium
4347.0,Sequoia National Forest,2016,False,Tulare,54,2016-12-19 13:30:00+00:00,35.984,	East of Trail of 100 Giants between Lloyd Meadow Road and Western Divide Highway.,-118.551,False,Meadow Fire,2016-10-29 11:15:00+00:00,89c304db-e288-4582-90d4-884d57fd71f9,51.09375,2016.0,0.028060109289617486,Medium
3929.0,CALFIRE Sonoma-Lake-Napa Unit,2016,True,Lake,17,2016-08-26 18:00:00+00:00,38.89741,off Hwy 29 and Clayton Creek south of Lower Lake,-122.60664,True,Clayton Fire,2016-08-13 18:03:00+00:00,a0950d5e-6f35-4023-bb60-6737146ba7bd,12.997916666666667,2016.0,0.028060109289617486,Medium
3876.0,CAL FIRE San Benito-Monterey Unit,2016,True,Monterey,27,2016-05-25 18:15:00+00:00,36.38123,"Metz Rd & Blue Jay Ln, southeast of Soledad",-121.20059,True,Metz Fire,2016-05-22 15:27:00+00:00,55fa95e6-f09e-42c4-889b-a4b5b63dccf2,3.1166666666666667,2016.0,0.028060109289617486,Medium
3712.0,Camp Roberts Fire Department,2016,True,San Luis Obispo,40,2016-05-20 18:00:00+00:00,0.0,10 miles northwest of Paso Robles on Camp Roberts Military Base,0.0,False,Roberts Fire,2016-05-18 14:27:00+00:00,50f908c4-841a-4125-8563-5c3e1866ff8a,2.1479166666666667,2016.0,0.028060109289617486,Medium
2944.0,CAL FIRE Fresno Unit,2016,True,Fresno,10,2016-07-05 07:05:00+00:00,36.0749,"Curry Mountain, 7 miles SW of Coalinga",-120.452041,True,Curry Fire,2016-07-01 17:16:00+00:00,423df2bd-4464-44e0-8b8a-74f953613287,3.5756944444444443,2016.0,0.028060109289617486,Medium
2860.0,USFS Klamath National Forest ,2016,False,Siskiyou,47,2016-11-08 10:15:00+00:00,41.623,15 miles SW of Happy Camp (Siskiyou County),-123.557,False,Pony Fire,2016-06-07 02:45:00+00:00,103e1cb6-0a02-4ca8-8739-4cf77b5d1c98,154.3125,2016.0,0.028060109289617486,Medium
2819.0,Inyo National Forest,2016,False,Mono,26,2016-08-07 19:14:00+00:00,0.0,"on Bald Mountain, northeast of Mammoth",0.0,False,Clark Fire,2016-08-04 14:09:00+00:00,afa76746-3e42-48ed-bff6-e65ef40c6037,3.2118055555555554,2016.0,0.028060109289617486,Medium
2652.0,Modoc National Forest,2016,False,Modoc,25,2016-10-13 11:30:00+00:00,41.2649,"Soup Springs, 12 miles east of Likely",-120.3178,False,Soup Complex,2016-09-17 14:37:00+00:00,92c20948-6ff6-4a2c-b13f-32c75e71b16c,25.87013888888889,2016.0,0.028060109289617486,Medium
2575.0,CAL FIRE Lassen-Modoc Unit,2016,True,Lassen,18,2016-09-22 07:00:00+00:00,40.3915,"off of Willard Creek Road, west of Susanville",-120.7845,True,Willard Fire,2016-09-11 11:33:00+00:00,1243f711-c29f-4bc3-a7e7-c705a6fc40f2,10.810416666666667,2016.0,0.028060109289617486,Medium
2520.0,Los Padres National Forest,2016,True,Monterey,27,2016-06-20 08:30:00+00:00,36.01542,off Mission Creek Rd and Milpitas Rd north of Fort Hunter Liggett,-121.25029,False,Coleman Fire,2016-06-04 14:33:00+00:00,b8cf80c7-b617-4fe4-91b0-43b40d38c7f6,15.747916666666667,2016.0,0.028060109289617486,Medium
2304.0,Los Padres National Forest,2016,False,Ventura,56,2016-06-30 16:55:00+00:00,34.701,"Near Haddock Campground, 3 miles west of the Pine Mtn Lodge, above Middle Sespe.",-119.144,False,Pine Fire,2016-06-30 16:55:00+00:00,8653f541-d3ca-44b4-9edd-5a4a57349f2f,0.0,2016.0,0.028060109289617486,Medium
